{
  "id": "B2-lesson-38",
  "num": 38,
  "level": "B2",
  "title": "Формальное письмо и отчёт",
  "minutes": 15,
  "objectives": [
    "Освоить структуру формального письма и краткого отчёта: цель, контекст, аргументы, просьба/решение, завершение",
    "Использовать формальные клише, дискурсивные маркеры и корректный регистр"
  ],
  "sections": [
    {
      "type": "text",
      "title": "Формальное письмо и отчёт",
      "content": "Освоить структуру формального письма и краткого отчёта: цель, контекст, аргументы, просьба/решение, завершение. Использовать формальные клише, дискурсивные маркеры и корректный регистр."
    },
    {
      "type": "grammar",
      "title": "Структура формального письма",
      "content": "- Aanhef: Geachte heer/mevrouw, / Geachte heer Jansen,\n- Inleiding (doel): Hierbij wil ik u informeren/verzoeken/vragen...\n- Kern (details/argumenten): Ten eerste..., vervolgens..., daarnaast...\n- Afsluiting (действие): Ik zie uw reactie graag tegemoet. / Bij voorbaat dank.\n- Groet: Met vriendelijke groet, / Hoogachtend,\nПример:\nGeachte mevrouw De Vries,\nHierbij wil ik u informeren over de vertraging van het project. Ten eerste is het leveringsprobleem...\nDaarnaast stellen wij voor om de planning aan te passen, zodat de kwaliteit geborgd blijft.\nBij voorbaat dank voor uw begrip.\nMet vriendelijke groet,\n...",
      "codeExamples": [
        "Geachte mevrouw De Vries,\nHierbij wil ik u informeren over de vertraging van het project. Ten eerste is het leveringsprobleem...\nDaarnaast stellen wij voor om de planning aan te passen, zodat de kwaliteit geborgd blijft.\nBij voorbaat dank voor uw begrip.\nMet vriendelijke groet,\n..."
      ]
    },
    {
      "type": "grammar",
      "title": "Регистры и клише",
      "content": "- verzoeken i.p.v. vragen; informeren i.p.v. zeggen\n- betreffende / naar aanleiding van — касательно / в связи с\n- conform afspraak — согласно договорённости\n- bijgevoegd / als bijlage — во вложении\nКогезия:\n- bovendien, echter, daarentegen; zodat, waardoor; kortom, samenvattend"
    },
    {
      "type": "text",
      "title": "Краткий отчёт (notulen / verslag)",
      "content": "Структура: Context → Doel → Bevindingen → Analyse → Aanbevelingen → Volgende stappen\nПример фрагмента:\n```\nDoel: Evalueren van de pilotfase.\nBevindingen: De responstijd is verbeterd; echter blijft de foutmarge 3%.\nAanbeveling: Extra training, zodat de foutmarge onder 1% komt.\n```"
    },
    {
      "type": "text",
      "title": "Мини‑сценка (телефон + follow‑up)",
      "content": "```\nA: Goedemiddag, ik bel naar aanleiding van uw e‑mail.\nB: Dank u. Kunt u een schriftelijke bevestiging sturen?\nA: Zeker. Ik stuur zo een overzicht met bijgevoegde planning.\n```"
    },
    {
      "type": "exercises",
      "title": "Упражнение 1: Неформально -> формально",
      "content": "| Неформально | Формально |\n|-------------|-----------|\n| Hoi, ik wil wat vragen. | -> `_______` |\n| Hier is het bestand. | -> `_______` |\n| Zoals we hadden afgesproken... | -> `_______` |\n| Ik wil graag een antwoord. | -> `_______` |\n| Doei! | -> `_______` |\n<details>\n<summary>Ответы</summary>\n1. Geachte heer/mevrouw, hierbij wil ik u een vraag stellen.\n2. Bijgevoegd vindt u het bestand. / Als bijlage treft u het bestand aan.\n3. Conform afspraak...\n4. Ik zie uw reactie graag tegemoet.\n5. Met vriendelijke groet,\n</details>"
    },
    {
      "type": "exercises",
      "title": "Упражнение 2: Вставь формальные клише",
      "items": [
        {
          "question": "__ wil ik u informeren over de voortgang van het project."
        },
        {
          "question": "__ uw e-mail van 10 april..."
        },
        {
          "question": "__ vindt u het rapport."
        },
        {
          "question": "__ stuur ik u de aangepaste planning."
        },
        {
          "question": "__ voor uw medewerking.",
          "answers": [
            "1. Hierbij",
            "2. Naar aanleiding van",
            "3. Bijgevoegd",
            "4. Conform afspraak",
            "5. Bij voorbaat dank"
          ]
        }
      ]
    },
    {
      "type": "exercises",
      "title": "Упражнение 3: Schrijf een formeel email",
      "content": "Situatie: Je project heeft vertraging. Schrijf een email aan je manager (6-8 zinnen):\n- Aanhef\n- Reden van de email (hierbij/naar aanleiding van)\n- Uitleg van de vertraging (ten eerste/bovendien)\n- Voorstel voor oplossing (zodat)\n- Afsluiting"
    },
    {
      "type": "exercises",
      "title": "Упражнение 4: Mini-verslag",
      "content": "Schrijf een kort verslag (4 blokken):\n- Doel: evaluatie van de pilotfase\n- Bevindingen: 2 positieve punten, 1 aandachtspunt\n- Aanbeveling: concrete actie\n- Volgende stappen: wie, wat, wanneer"
    },
    {
      "type": "text",
      "title": "Словарь урока (20–25)",
      "content": "- Geachte heer/mevrouw — уважаемый господин/госпожа\n- hierbij — настоящим (этим письмом)\n- naar aanleiding van — в связи с, касательно\n- betreffende — касающийся\n- verzoeken — просить официально\n- informeren — информировать\n- bevestigen — подтверждать\n- bijgevoegd / als bijlage — приложенный / во вложении\n- conform afspraak — согласно договорённости\n- planning — план‑график\n- bevindingen — результаты (выводы)\n- aanbeveling — рекомендация\n- vervolg(stappen) — последующие шаги\n- bovendien — кроме того\n- echter — однако\n- daarentegen — с другой стороны\n- zodat — так что (в результате)\n- waardoor — вследствие чего\n- samenvattend — подытоживая\n- kortom — короче\n- termijn — срок\n- vertraging — задержка\n- kwaliteitsborging — обеспечение качества\n- afstemmen — согласовать"
    }
  ],
  "vocabularyFile": "B2-lesson-38.json"
}
