{
  "id": "A2-lesson-22",
  "num": 22,
  "level": "A2",
  "title": "Телефонные разговоры",
  "minutes": 15,
  "objectives": [
    "Отвечать на телефонные звонки профессионально",
    "Звонить и договариваться о встречах",
    "Оставлять и понимать голосовые сообщения",
    "Решать проблемы по телефону",
    "Использовать формальный стиль в телефонных разговорах"
  ],
  "sections": [
    {
      "type": "text",
      "title": "Фаза 1: Начало разговора (4 минуты)",
      "content": "**Как отвечать на звонки**:\n#### Неформально (дома, друзья):\n- **Hallo** - Алло\n- **Met [имя]** - Это [имя]\n- **Ja?** - Да?\n#### Формально (работа, незнакомые):\n- **Goedemorgen, met [фамилия]** - Доброе утро, это [фамилия]\n- **[Название компании], u spreekt met [имя]** - [Компания], говорит [имя]\n- **Waarmee kan ik u helpen?** - Чем могу помочь?\n#### Как представиться (звонящий):\n- **Hallo, u spreekt met [имя]** - Здравствуйте, это [имя]\n- **Met [имя] van [компания]** - Это [имя] из [компании]\n- **Ik zou graag [цель звонка]** - Я хотел бы [цель]"
    },
    {
      "type": "vocabulary",
      "title": "Фаза 2: Основные фразы (5 минут)",
      "words": [
        {
          "nl": "Mag ik [naam] spreken?",
          "ru": "Можно [имя]?"
        },
        {
          "nl": "Kunt u mij doorverbinden met...?",
          "ru": "Можете соединить с...?"
        },
        {
          "nl": "Is [naam] aanwezig?",
          "ru": "[Имя] на месте?"
        },
        {
          "nl": "Een momentje alstublieft",
          "ru": "Минутку, пожалуйста"
        },
        {
          "nl": "Ik verbind u door",
          "ru": "Соединяю"
        },
        {
          "nl": "Hij/zij is er niet",
          "ru": "Его/ее нет"
        },
        {
          "nl": "Kan ik een boodschap aannemen?",
          "ru": "Могу принять сообщение?"
        },
        {
          "nl": "Ik versta u niet goed",
          "ru": "Плохо слышу"
        },
        {
          "nl": "Kunt u wat harder praten?",
          "ru": "Можете говорить громче?"
        },
        {
          "nl": "De verbinding is slecht",
          "ru": "Плохая связь"
        },
        {
          "nl": "Kunnen we opnieuw bellen?",
          "ru": "Можем перезвонить?"
        }
      ]
    },
    {
      "type": "text",
      "title": "Фаза 3: Деловые разговоры (4 минуты)",
      "content": "**Планирование и договоренности**:\n#### Планирование встреч:\n- **Kunnen we een afspraak maken?** - Можем назначить встречу?\n- **Wanneer schikt het u?** - Когда вам удобно?\n- **Heeft u tijd op [день] om [время]?** - Есть время в [день] в [время]?\n- **Dat komt mij goed uit** - Мне подходит\n#### Подтверждение информации:\n- **Mag ik dat even herhalen?** - Можно повторить?\n- **Is uw telefoonnummer...?** - Ваш номер...?\n- **Ik noteer: [информация]** - Записываю: [информация]\n- **Klopt dat?** - Правильно?"
    },
    {
      "type": "text",
      "title": "Фаза 4: Завершение разговора (2 минуты)",
      "content": "**Как закончить вежливо**:\n#### Неформально:\n- **Oké, ik ga ophangen** - Ладно, кладу трубку\n- **Tot later!** - До встречи!\n- **Spreek je snel** - Поговорим скоро\n#### Формально:\n- **Dank u wel voor uw tijd** - Спасибо за время\n- **Tot ziens** - До свидания\n- **Prettige dag verder** - Хорошего дня"
    },
    {
      "type": "text",
      "title": "1. Формальность в телефонных разговорах",
      "content": "#### U vs Jij:\n**Используй \"u\"**:\n- С незнакомыми людьми\n- В деловых разговорах\n- С пожилыми людьми\n- В сервисе\n**Используй \"jij\"**:\n- С друзьями и семьей\n- С ровесниками\n- В неформальной обстановке"
    },
    {
      "type": "grammar",
      "title": "2. Модальные глаголы в вежливых просьбах",
      "content": "#### Уровни вежливости:\n#### Примеры:",
      "examples": [
        {
          "nl": "Kan ik...?",
          "ru": "Могу я...? (нейтрально)"
        },
        {
          "nl": "Mag ik...?",
          "ru": "Можно мне...? (вежливо)"
        },
        {
          "nl": "Zou ik kunnen...?",
          "ru": "Мог бы я...? (очень вежливо)"
        },
        {
          "nl": "Kan ik je terugbellen?",
          "ru": "Могу перезвонить?"
        },
        {
          "nl": "Mag ik een vraag stellen?",
          "ru": "Можно вопрос?"
        },
        {
          "nl": "Zou u wat langzamer kunnen spreken?",
          "ru": "Могли бы говорить медленнее?"
        }
      ]
    },
    {
      "type": "text",
      "title": "1. Звонок врачу:",
      "content": "**Пациент**: Goedemiddag, ik zou graag een afspraak maken.\n**Assistente**: Voor welke dokter?\n**Пациент**: Voor dokter Van der Berg.\n**Assistente**: Wat zijn uw klachten?\n**Пациент**: Ik heb last van hoofdpijn."
    },
    {
      "type": "text",
      "title": "2. Звонок в компанию:",
      "content": "**Рецепционист**: ABC Bedrijf, goedemorgen.\n**Звонящий**: Goedemorgen, mag ik de heer Jansen spreken?\n**Рецепционист**: Een momentje, ik kijk of hij beschikbaar is.\n**Звонящий**: Dank u wel."
    },
    {
      "type": "text",
      "title": "3. Техническая поддержка:",
      "content": "**Клиент**: Mijn internet werkt niet.\n**Техник**: Kunt u de router opnieuw opstarten?\n**Клиент**: Hoe doe ik dat?\n**Техник**: Trek de stekker eruit en steek hem weer in."
    },
    {
      "type": "culture",
      "title": "Телефонный этикет в Нидерландах",
      "content": "**Пунктуальность**:\n- Звонить в рабочее время (9:00-17:00)\n- Не звонить поздно вечером (после 21:00)\n- Не звонить в выходные без договоренности\n**Прямота**:\n- Сразу называть цель звонка\n- Быть кратким и конкретным\n- Не тратить время на long small talk\n**Деловой этикет**:\n- Всегда представляться при звонке\n- Говорить четко и не спешить\n- Подтверждать важную информацию письменно\n**Технологии**:\n- WhatsApp часто предпочитают звонкам\n- Многие используют определитель номера\n- Voicemail (голосовая почта) очень популярна\n**Для интеграции**: Умение профессионально говорить по телефону критично для работы и решения ежедневных вопросов."
    },
    {
      "type": "exercises",
      "title": "Упражнение 1: Ролевая игра - Запись к врачу",
      "content": "**Роли**: Пациент и медсестра\n**Задача**: Записаться на прием на следующей неделе"
    },
    {
      "type": "exercises",
      "title": "Упражнение 2: Деловой звонок",
      "content": "**Ситуация**: Звонишь в компанию, чтобы узнать о вакансии\n**Практика**: Формальное представление и вежливые вопросы"
    },
    {
      "type": "exercises",
      "title": "Упражнение 3: Проблемы со связью",
      "content": "**Ситуация**: Плохо слышно собеседника\n**Практика**: Просьбы повторить и говорить громче"
    },
    {
      "type": "text",
      "title": "Голосовая почта (Voicemail):",
      "content": "- **U bent verbonden met de voicemail van...** - Голосовая почта...\n- **Spreek uw boodschap in na de piep** - Оставьте сообщение после сигнала\n- **Ik bel u zo snel mogelijk terug** - Перезвоню как можно скорее"
    },
    {
      "type": "text",
      "title": "WhatsApp звонки:",
      "content": "- **Kan ik je via WhatsApp bellen?** - Можно позвонить через WhatsApp?\n- **De gewone lijn is duur** - Обычная связь дорогая\n- **Video of alleen geluid?** - Видео или только звук?"
    },
    {
      "type": "text",
      "title": "Teams/Zoom встречи:",
      "content": "- **Kunnen we een videogesprek plannen?** - Можем запланировать видеозвонок?\n- **Ik stuur je de link** - Отправлю ссылку\n- **Om hoe laat loggen we in?** - Во сколько подключаемся?"
    }
  ],
  "vocabularyFile": "A2-lesson-22.json"
}
