{
  "id": "A2-lesson-23",
  "num": 23,
  "level": "A2",
  "title": "Образование и учёба",
  "minutes": 15,
  "objectives": [
    "Говорить о системе образования в Нидерландах",
    "Обсуждать учебу и экзамены",
    "Выражать мнения об образовании",
    "Рассказывать о своем образовательном опыте",
    "Понимать голландскую образовательную систему"
  ],
  "sections": [
    {
      "type": "vocabulary",
      "title": "Фаза 1: Система образования (4 минуты)",
      "words": [
        {
          "nl": "de basisschool",
          "ru": "начальная школа",
          "hint": "основы"
        },
        {
          "nl": "het voortgezet onderwijs",
          "ru": "среднее образование",
          "hint": "специализация"
        },
        {
          "nl": "het gymnasium",
          "ru": "гимназия",
          "hint": "академический"
        },
        {
          "nl": "de mavo",
          "ru": "средняя школа",
          "hint": "практический"
        },
        {
          "nl": "het havo",
          "ru": "высшая средняя",
          "hint": "подготовка к ВУЗу"
        },
        {
          "nl": "het vwo",
          "ru": "предуниверситет",
          "hint": "для университета"
        },
        {
          "nl": "Nederlands",
          "ru": "Русский",
          "hint": "Описание"
        },
        {
          "nl": "de universiteit",
          "ru": "университет",
          "hint": "академическое"
        },
        {
          "nl": "de hogeschool",
          "ru": "вуз прикладных наук",
          "hint": "практическое"
        },
        {
          "nl": "het mbo",
          "ru": "среднее профессиональное",
          "hint": "профессии"
        }
      ]
    },
    {
      "type": "text",
      "title": "Фаза 2: Учебные предметы (4 минуты)",
      "content": "**Школьные предметы**:\n#### Основные предметы:\n- **Nederlands** - нидерландский язык\n- **Engels** - английский язык\n- **wiskunde** - математика\n- **geschiedenis** - история\n- **aardrijkskunde** - география\n- **natuurkunde** - физика\n- **scheikunde** - химия\n- **biologie** - биология\n#### Дополнительные:\n- **sport** - физкультура\n- **kunst** - искусство\n- **muziek** - музыка\n- **informatica** - информатика\n- **economie** - экономика"
    },
    {
      "type": "text",
      "title": "Фаза 3: Учебный процесс (5 минут)",
      "content": "**Учеба и экзамены**:\n#### Учебная деятельность:\n- **studeren** - учиться (в вузе)\n- **leren** - учить, изучать\n- **een tentamen maken** - сдавать экзамен\n- **slagen** - сдать (успешно)\n- **zakken** - провалить экзамен\n- **herhalen** - пересдавать\n#### Оценки:\n- **het cijfer** - оценка\n- **een voldoende** - зачет (6+)\n- **een onvoldoende** - незачет (<6)\n- **een tien** - десятка (отлично)\n- **gemiddeld** - в среднем\n#### Учебные материалы:\n- **het boek** - учебник\n- **de les** - урок\n- **het huiswerk** - домашнее задание\n- **de presentatie** - презентация\n- **het onderzoek** - исследование"
    },
    {
      "type": "text",
      "title": "1. Выражение мнений об образовании",
      "content": "#### Позитивные мнения:\n- **Ik vind onderwijs belangrijk** - Считаю образование важным\n- **Deze cursus is nuttig** - Этот курс полезный\n- **De leraar legt het goed uit** - Учитель хорошо объясняет\n#### Критические мнения:\n- **Het systeem is te streng** - Система слишком строгая\n- **Er is te veel huiswerk** - Слишком много домашки\n- **De examens zijn te moeilijk** - Экзамены слишком трудные"
    },
    {
      "type": "text",
      "title": "2. Прошедшее время для рассказа об образовании",
      "content": "#### Рассказ о школе:\n- **Ik heb op het gymnasium gezeten** - Учился в гимназии\n- **We hebben veel geleerd** - Много изучали\n- **Ik ben geslaagd voor mijn eindexamen** - Сдал выпускные экзамены"
    },
    {
      "type": "text",
      "title": "3. Будущее время для планов",
      "content": "- **Ik ga rechten studeren** - Буду изучать право\n- **Volgend jaar zal ik afstuderen** - В следующем году закончу\n- **We gaan een master doen** - Будем делать магистратуру\n**Подробнее**: [Культура: Образование](../../../CULTURE/society/education.md)"
    },
    {
      "type": "culture",
      "title": "Голландская система образования",
      "content": "**Особенности системы**:\n- Раннее разделение по способностям (12 лет)\n- Три уровня среднего образования\n- Высокое качество высшего образования\n- Много программ на английском языке\n**Культура обучения**:\n- **Zelfredzaamheid** - самостоятельность важна\n- Критическое мышление поощряется\n- Групповые проекты очень популярны\n- Баланс между учебой и отдыхом\n**Университетская жизнь**:\n- **Studievereniging** - студенческие союзы\n- **Intro week** - неделя знакомства\n- **Tentamenperiode** - период экзаменов\n- **Scriptiebegeleider** - научный руководитель\n**Практические аспекты**:\n- **Collegegeld** - плата за обучение (около €2000)\n- **Studiefinanciering** - студенческие кредиты\n- **OV-chipkaart** - бесплатный транспорт для студентов\n- **Bijbaan** - подработка во время учебы\n**Для интеграции**: Понимание образовательной системы поможет в карьере и общении с голландцами."
    },
    {
      "type": "exercises",
      "title": "Упражнение 1: Рассказ о своем образовании",
      "items": [
        {
          "question": "Где ты учился в школе?"
        },
        {
          "question": "Какие предметы любил?"
        },
        {
          "question": "Какое получил высшее образование?"
        },
        {
          "question": "Планируешь ли учиться дальше?"
        }
      ]
    },
    {
      "type": "exercises",
      "title": "Упражнение 2: Сравнение систем",
      "content": "Сравни голландскую и российскую системы образования:\n- Сходства\n- Различия\n- Плюсы и минусы"
    },
    {
      "type": "exercises",
      "title": "Упражнение 3: Диалог о учебе",
      "content": "**Ролевая игра**: Встреча двух студентов\n- Обсуждение экзаменов\n- Планы на каникулы\n- Выбор специализации"
    },
    {
      "type": "text",
      "title": "Популярные направления:",
      "content": "- **Geneeskunde** - медицина\n- **Rechten** - право\n- **Economie** - экономика\n- **Psychologie** - психология\n- **Techniek** - техника\n- **Talen** - языки\n- **Kunst** - искусство"
    },
    {
      "type": "text",
      "title": "Профессиональное образование:",
      "content": "- **Verpleegkunde** - медсестринское дело\n- **ICT** - информационные технологии\n- **Bouw** - строительство\n- **Horeca** - гостиничный бизнес\n- **Zorg** - соцработа"
    }
  ],
  "vocabularyFile": "A2-lesson-23.json"
}
