{
  "id": "B2-lesson-47",
  "num": 47,
  "level": "B2",
  "title": "Презентации и публичная речь",
  "minutes": 15,
  "objectives": [],
  "sections": [
    {
      "type": "text",
      "title": "Презентации и публичная речь",
      "content": "Проводить структурированные презентации: ввод, signposting (дорожные указатели), логические переходы, визуальная поддержка, чёткое завершение и Q&A.\n**Время изучения**: 15 минут\n**Уровень**: B2"
    },
    {
      "type": "grammar",
      "title": "Структура и signposting",
      "content": "- Opening: Goedemiddag, vandaag wil ik het hebben over...\n- Overzicht: Eerst bespreek ik..., vervolgens..., tot slot...\n- Transities: Laten we doorgaan met..., Dit brengt ons bij..., Om samen te vatten...\n- Q&A: Zijn er nog vragen? / Graag hoor ik uw feedback.\nВизуалы: eenvoudige grafieken, kernwoorden, één идея на слайд.\n---"
    },
    {
      "type": "text",
      "title": "Мини‑фрагмент",
      "content": "```\nVandaag presenteer ik de resultaten. Eerst het doel en de methode; vervolgens de bevindingen; tot slot de aanbevelingen. Om samen te vatten: de impact is significant.\n```"
    },
    {
      "type": "exercises",
      "title": "Упражнение 1: Signposting -- вставь переходные фразы",
      "items": [
        {
          "question": "__, vandaag wil ik het hebben over duurzaam transport."
        },
        {
          "question": "__ bespreek ik de huidige situatie; __ de oplossingen; __ de aanbevelingen."
        },
        {
          "question": "__ doorgaan met het volgende punt."
        },
        {
          "question": "__, de conclusie is dat investeren in fietspaden loont."
        },
        {
          "question": "__? Ik hoor graag uw reactie.",
          "answers": [
            "1. Goedemiddag (opening)",
            "2. Eerst ... vervolgens ... tot slot (overzicht)",
            "3. Laten we (transitie)",
            "4. Om samen te vatten (conclusie)",
            "5. Zijn er nog vragen (Q&A)"
          ]
        }
      ]
    },
    {
      "type": "exercises",
      "title": "Упражнение 2: Maak een presentatieplan",
      "items": [
        {
          "question": "Titel + naam"
        },
        {
          "question": "Doel van de presentatie"
        },
        {
          "question": "Huidige situatie (feiten/cijfers)"
        },
        {
          "question": "Voordelen (gezondheid, milieu, kosten)"
        },
        {
          "question": "Aanbevelingen"
        },
        {
          "question": "Vragen"
        }
      ]
    },
    {
      "type": "exercises",
      "title": "Упражнение 3: Monoloog (90 seconden)",
      "content": "Geef een mini-presentatie over je plan uit Упражнение 2.\nGebruik minstens:\n- 1 opening-frase\n- 1 overzicht (eerst/vervolgens/tot slot)\n- 2 transities\n- 1 samenvatting"
    },
    {
      "type": "exercises",
      "title": "Упражнение 4: Переведи на нидерландский (формальный регистр)",
      "items": [
        {
          "question": "Добрый день, сегодня я хотел бы поговорить о результатах проекта."
        },
        {
          "question": "Сначала я расскажу о методе, затем о результатах."
        },
        {
          "question": "Подводя итог, результаты показывают значительное улучшение.",
          "answers": [
            "1. Goedemiddag, vandaag wil ik het hebben over de projectresultaten.",
            "2. Eerst bespreek ik de methode, vervolgens de resultaten.",
            "3. Samenvattend tonen de resultaten een significante verbetering."
          ]
        }
      ]
    },
    {
      "type": "text",
      "title": "Словарь урока (20–25)",
      "content": "- presentatie — презентация\n- signposting language — «указатели» речи\n- overzicht — обзор\n- bevindingen — результаты\n- aanbevelingen — рекомендации\n- overgang — переход\n- inleiding/slot — ввод/заключение\n- kernboodschap — основное послание\n- dia/slide — слайд\n- grafiek — график\n- visueel — визуальный\n- impact — влияние\n- significant — существенный\n- helder — ясный\n- bondig — краткий\n- tempo — темп\n- publiek — аудитория\n- betrokkenheid — вовлечённость\n- feedback — обратная связь\n- vraagronde — сессия вопросов\n- benadrukken — подчёркивать\n- samenvatten — подытоживать"
    }
  ],
  "vocabularyFile": "B2-lesson-47.json"
}
